{
  "schemaVersion": 1,
  "site": "shop.example.com",
  "locale": "en-CA",
  "startPath": "/support",
  "steps": [
    {
      "action": "open_chat",
      "label": "Chat with us"
    },
    {
      "action": "select",
      "label": "Something else"
    },
    {
      "action": "fill_required",
      "label": "Email"
    },
    {
      "action": "send",
      "value": "live agent"
    },
    {
      "action": "wait_for_human"
    }
  ],
  "verifiedOn": "2026-08-23"
}

